{
 "schema": "vsetin-osint/oprava-hodnot-registru@1",
 "zdroj": "https://smlouvy.gov.cz/smlouva/{version_id} (HTML detail, 1 dotaz/1–6 s)",
 "stazeno": "2026-10-23 09:00–09:30 SELČ",
 "vstup": "244 verzí s value_kind='nezjisteno' z /api/registry/contracts nasvsetin.cz (vzorek 500 nejnovějších verzí, 05–10/2026); 215 unikátních version_id (29 duplicit = obě strany jsou sledované subjekty)",
 "souhrn": {
  "unikatnich": 215,
  "nezjisteno": 66,
  "s_dph": 149,
  "soucet_s_dph_doplnitelny": 1182189965.31
 },
 "pozor": "Hodnoty jsou formální údaj registru (pole hodnotaVcetneDph), nikoli platba. DPH nepřepočítávat.",
 "verze": [
  {
   "version_id": "37926737",
   "bez_dph": null,
   "s_dph": null,
   "mena": null,
   "cizi_mena": null,
   "predmet": "Dodatek č. 1 - změna termínu plnění",
   "datum_uzavreni": "12.05.2026",
   "value_kind_navrh": "nezjisteno"
  },
  {
   "version_id": "37942785",
   "bez_dph": null,
   "s_dph": null,
   "mena": null,
   "cizi_mena": null,
   "predmet": "OSTATNÍ - Smlouva o centralizovaném zadávání na nákup komodit pro rok 2029",
   "datum_uzavreni": "12.05.2026",
   "value_kind_navrh": "nezjisteno"
  },
  {
   "version_id": "37942793",
   "bez_dph": null,
   "s_dph": null,
   "mena": null,
   "cizi_mena": null,
   "predmet": "OSTATNÍ - Smlouva o centralizovaném zadávání na nákup komodit pro rok 2029",
   "datum_uzavreni": "12.05.2026",
   "value_kind_navrh": "nezjisteno"
  },
  {
   "version_id": "37942809",
   "bez_dph": null,
   "s_dph": null,
   "mena": null,
   "cizi_mena": null,
   "predmet": "OSTATNÍ - Smlouva o centralizovaném zadávání na nákup komodit pro rok 2029",
   "datum_uzavreni": "12.05.2026",
   "value_kind_navrh": "nezjisteno"
  },
  {
   "version_id": "37947337",
   "bez_dph": null,
   "s_dph": 129954.0,
   "mena": "CZK",
   "cizi_mena": null,
   "predmet": "Nákup multifunkční zařízení Konica Minolta bizhub C301i",
   "datum_uzavreni": "12.05.2026",
   "value_kind_navrh": "s_dph"
  },
  {
   "version_id": "37947357",
   "bez_dph": null,
   "s_dph": null,
   "mena": null,
   "cizi_mena": null,
   "predmet": "OSTATNÍ - Smlouva o centralizovaném zadávání na nákup komodit pro rok 2026",
   "datum_uzavreni": "12.05.2026",
   "value_kind_navrh": "nezjisteno"
  },
  {
   "version_id": "37947361",
   "bez_dph": null,
   "s_dph": null,
   "mena": null,
   "cizi_mena": null,
   "predmet": "OSTATNÍ - Smlouva o cnetralizovaném zadávání na nákup komodit pro rok 2029",
   "datum_uzavreni": "12.05.2026",
   "value_kind_navrh": "nezjisteno"
  },
  {
   "version_id": "37947365",
   "bez_dph": null,
   "s_dph": null,
   "mena": null,
   "cizi_mena": null,
   "predmet": "OSTATNÍ - Smlouva o centralizovaném zadávání na nákup komodit pro rok 2029",
   "datum_uzavreni": "12.05.2026",
   "value_kind_navrh": "nezjisteno"
  },
  {
   "version_id": "37954813",
   "bez_dph": null,
   "s_dph": 65500.0,
   "mena": "CZK",
   "cizi_mena": null,
   "predmet": "Objednávka pobytového programu",
   "datum_uzavreni": "07.04.2026",
   "value_kind_navrh": "s_dph"
  },
  {
   "version_id": "37977165",
   "bez_dph": null,
   "s_dph": 290640.0,
   "mena": "CZK",
   "cizi_mena": null,
   "predmet": "Elektronické stravné na 05/2026, 2076 ks á140 Kč",
   "datum_uzavreni": "13.05.2026",
   "value_kind_navrh": "s_dph"
  },
  {
   "version_id": "37977169",
   "bez_dph": null,
   "s_dph": null,
   "mena": null,
   "cizi_mena": null,
   "predmet": "Dodatek č. 2 o prodloužení smlouvy",
   "datum_uzavreni": "13.05.2026",
   "value_kind_navrh": "nezjisteno"
  },
  {
   "version_id": "38001917",
   "bez_dph": null,
   "s_dph": 75000.0,
   "mena": "CZK",
   "cizi_mena": null,
   "predmet": "Podchod - Rybníky trávníky (výmalba čelní strana)",
   "datum_uzavreni": "28.04.2026",
   "value_kind_navrh": "s_dph"
  },
  {
   "version_id": "38006101",
   "bez_dph": null,
   "s_dph": null,
   "mena": null,
   "cizi_mena": null,
   "predmet": "Smlouva o postoupení nájemní smlouvy",
   "datum_uzavreni": "18.05.2026",
   "value_kind_navrh": "nezjisteno"
  },
  {
   "version_id": "38107021",
   "bez_dph": null,
   "s_dph": 156000.0,
   "mena": "CZK",
   "cizi_mena": null,
   "predmet": "DOTACE - Veřejnoprávní smlouva o poskytnutí dotace z rozpočtu města Vsetína",
   "datum_uzavreni": "22.05.2026",
   "value_kind_navrh": "s_dph"
  },
  {
   "version_id": "38107033",
   "bez_dph": null,
   "s_dph": null,
   "mena": null,
   "cizi_mena": null,
   "predmet": null,
   "datum_uzavreni": "19.05.2026",
   "value_kind_navrh": "nezjisteno"
  },
  {
   "version_id": "38107037",
   "bez_dph": null,
   "s_dph": 190000.0,
   "mena": "CZK",
   "cizi_mena": null,
   "predmet": "DOTACE - Veřejnoprávní smlouva o poskytnutí dotace na pravidelnou celoroční sportovní činnost v roce 2026",
   "datum_uzavreni": "22.05.2026",
   "value_kind_navrh": "s_dph"
  },
  {
   "version_id": "38108093",
   "bez_dph": null,
   "s_dph": 600000.0,
   "mena": "CZK",
   "cizi_mena": null,
   "predmet": null,
   "datum_uzavreni": "22.05.2026",
   "value_kind_navrh": "s_dph"
  },
  {
   "version_id": "38119505",
   "bez_dph": null,
   "s_dph": 1000000.0,
   "mena": "CZK",
   "cizi_mena": null,
   "predmet": "Darovací smlouva - rozvoj sportovní činnost mládeže v klubu obdarovaného v roce 2026",
   "datum_uzavreni": "21.04.2026",
   "value_kind_navrh": "s_dph"
  },
  {
   "version_id": "38123189",
   "bez_dph": null,
   "s_dph": 81438.0,
   "mena": "CZK",
   "cizi_mena": null,
   "predmet": "Revize a kontrola hasících přístrojů a hydrantů v bytových domech města Vsetín.",
   "datum_uzavreni": "21.05.2026",
   "value_kind_navrh": "s_dph"
  },
  {
   "version_id": "38123205",
   "bez_dph": null,
   "s_dph": 60085.0,
   "mena": "CZK",
   "cizi_mena": null,
   "predmet": "NÁJEM - Nájemní smlouva na pronájem prostor č.p.305, k.ú. Rokytnice u Vsetína.",
   "datum_uzavreni": "25.05.2026",
   "value_kind_navrh": "s_dph"
  },
  {
   "version_id": "38123209",
   "bez_dph": null,
   "s_dph": 223360.0,
   "mena": "CZK",
   "cizi_mena": null,
   "predmet": "NÁJEM - Nájemní smlouva na pronájem prostor č.p.1827,k.ú. Vsetín",
   "datum_uzavreni": "25.05.2026",
   "value_kind_navrh": "s_dph"
  },
  {
   "version_id": "38164473",
   "bez_dph": null,
   "s_dph": 1028500.0,
   "mena": "CZK",
   "cizi_mena": null,
   "predmet": "Příkazní smlouva při realizaci stavby &quot;Kanalizace a vodovod Velký Skalník&quot;",
   "datum_uzavreni": "20.08.2025",
   "value_kind_navrh": "s_dph"
  },
  {
   "version_id": "38164649",
   "bez_dph": null,
   "s_dph": 302500.0,
   "mena": "CZK",
   "cizi_mena": null,
   "predmet": "Smlouva o výkonu BOZP při realizaci stavby &quot;Kanalizace a vodovod Velký Skalník&quot;",
   "datum_uzavreni": "20.08.2025",
   "value_kind_navrh": "s_dph"
  },
  {
   "version_id": "38164849",
   "bez_dph": null,
   "s_dph": 1808950.0,
   "mena": "CZK",
   "cizi_mena": null,
   "predmet": "Příkazní smlouva při realizaci stavby - Obnova vodovodního přivaděče v úseku ČS Ohrada - VDJ Bečevná, Vsetín",
   "datum_uzavreni": "20.08.2025",
   "value_kind_navrh": "s_dph"
  },
  {
   "version_id": "38165029",
   "bez_dph": null,
   "s_dph": 484000.0,
   "mena": "CZK",
   "cizi_mena": null,
   "predmet": "Smlouva o výkonu BOZP při realizaci stavby - Obnova vodovodního přivaděče v úseku ČS Ohrada - VDJ Bečevná, Vsetín",
   "datum_uzavreni": "20.08.2025",
   "value_kind_navrh": "s_dph"
  },
  {
   "version_id": "38165177",
   "bez_dph": null,
   "s_dph": 22767787.24,
   "mena": "CZK",
   "cizi_mena": null,
   "predmet": "Smlouva o dílo na realizaci stavby - Kanalizace a vodovod Velký Skalník",
   "datum_uzavreni": "20.08.2025",
   "value_kind_navrh": "s_dph"
  },
  {
   "version_id": "38165509",
   "bez_dph": null,
   "s_dph": 32537640.37,
   "mena": "CZK",
   "cizi_mena": null,
   "predmet": "Smlouva o dílo na realizaci stavby - Vodovod Zašová - rozšíření HTP",
   "datum_uzavreni": "25.08.2025",
   "value_kind_navrh": "s_dph"
  },
  {
   "version_id": "38165757",
   "bez_dph": null,
   "s_dph": 78473548.19,
   "mena": "CZK",
   "cizi_mena": null,
   "predmet": "Smlouva o dílo na realizaci stavby - Prodloužení vodovodu a kanalizace Nový Hrozenkov - Vranča a Malá Vranča",
   "datum_uzavreni": "20.08.2025",
   "value_kind_navrh": "s_dph"
  },
  {
   "version_id": "38181189",
   "bez_dph": null,
   "s_dph": 72150.0,
   "mena": "CZK",
   "cizi_mena": null,
   "predmet": "Objednávka pobytového programu",
   "datum_uzavreni": "18.05.2026",
   "value_kind_navrh": "s_dph"
  },
  {
   "version_id": "38181501",
   "bez_dph": null,
   "s_dph": 1317000.0,
   "mena": "CZK",
   "cizi_mena": null,
   "predmet": null,
   "datum_uzavreni": "27.05.2026",
   "value_kind_navrh": "s_dph"
  },
  {
   "version_id": "38181505",
   "bez_dph": null,
   "s_dph": null,
   "mena": null,
   "cizi_mena": null,
   "predmet": "Dohoda o skončení nájemní smlouvy na pronájem nebytových prostor",
   "datum_uzavreni": "11.05.2026",
   "value_kind_navrh": "nezjisteno"
  },
  {
   "version_id": "38181509",
   "bez_dph": null,
   "s_dph": 43300.0,
   "mena": "CZK",
   "cizi_mena": null,
   "predmet": "NÁJEM - Nájemní smlouva na pronájem nebytových prostor č.p.1484, k.ú. Vsetín",
   "datum_uzavreni": "29.05.2026",
   "value_kind_navrh": "s_dph"
  },
  {
   "version_id": "38181605",
   "bez_dph": null,
   "s_dph": 51450.0,
   "mena": "CZK",
   "cizi_mena": null,
   "predmet": "Objednávka pobytového programu",
   "datum_uzavreni": "18.05.2026",
   "value_kind_navrh": "s_dph"
  },
  {
   "version_id": "38184953",
   "bez_dph": null,
   "s_dph": 290707.0,
   "mena": "CZK",
   "cizi_mena": null,
   "predmet": "Vybudování dřevěného přístřešku Pro JSDH Vsetín - Rokytnice",
   "datum_uzavreni": "21.05.2026",
   "value_kind_navrh": "s_dph"
  },
  {
   "version_id": "38194181",
   "bez_dph": null,
   "s_dph": null,
   "mena": null,
   "cizi_mena": null,
   "predmet": "Dodatek č. 1 ke Smlouvě o zajištění služby venkovního osvětlení",
   "datum_uzavreni": "12.05.2026",
   "value_kind_navrh": "nezjisteno"
  },
  {
   "version_id": "38196681",